{
  "fileVersion": "1.0.0",
  "standardsVersion": "1.18.0",
  "title": "Automatically generated data file",
  "description": "Test data generated by the CDR Test Data CLI",
  "holders": [
    {
      "holderId": "801893278",
      "holder": {
        "unauthenticated": {},
        "authenticated": {
          "customers": [
            {
              "customerId": "121645127",
              "customer": {
                "customerUType": "organisation",
                "organisation": {
                  "physicalAddresses": [
                    {
                      "purpose": "REGISTERED",
                      "addressUType": "simple",
                      "simple": {
                        "mailingName": "Windler, Wolf and Patel",
                        "localityName": "Ebertmouth",
                        "addressLine1": "Fay Way",
                        "postcode": "7678",
                        "city": "Flower Mound",
                        "state": "Western Australia",
                        "country": "AUS"
                      }
                    },
                    {
                      "purpose": "MAIL",
                      "addressUType": "paf",
                      "paf": {
                        "localityName": "Turner and Sons",
                        "postcode": "6808",
                        "state": "Australian Capital Territory",
                        "postalDeliveryType": "LOCKED_BAG",
                        "postalDeliveryNumber": 28178337,
                        "flatUnitType": "UNIT",
                        "flatUnitNumber": "46"
                      }
                    },
                    {
                      "purpose": "OTHER",
                      "addressUType": "paf",
                      "paf": {
                        "localityName": "Leannon Brothers",
                        "postcode": "2032",
                        "state": "Western Australia",
                        "postalDeliveryType": "CARE_PO",
                        "postalDeliveryNumber": 28841385,
                        "postalDeliveryNumberSuffix": "STS",
                        "postalDeliveryNumberPrefix": "APT",
                        "thoroughfareNumber1": 8196,
                        "thoroughfareNumber1Suffix": "HWY",
                        "thoroughfareNumber2": 8202,
                        "thoroughfareNumber2Suffix": "HWY",
                        "flatUnitType": "UNIT",
                        "flatUnitNumber": "48",
                        "floorLevelNumber": "43",
                        "buildingName1": "Reception area"
                      }
                    }
                  ],
                  "agentRole": "Unspecified",
                  "businessName": "Parker, Gutmann and Stokes",
                  "organisationType": "COMPANY",
                  "agentLastName": "Cruickshank",
                  "industryCode": "556913",
                  "industryCodeVersion": "ANZSIC_1292.0_2006_V2.0",
                  "shortName": "Short Name",
                  "registeredCountry": "ARG",
                  "abn": "586-356-697",
                  "acn": "928-737-705"
                }
              },
              "energy": {
                "servicePoints": [
                  {
                    "servicePoint": {
                      "jurisdictionCode": "QLD",
                      "lastUpdateDateTime": "2023-01-12T01:38:58.409Z",
                      "nationalMeteringId": "6239077048",
                      "servicePointClassification": "LARGE",
                      "servicePointId": "b319c2fb-19b3-4863-a46b-9e1ae1284f53",
                      "servicePointStatus": "ACTIVE",
                      "validFromDate": "2022-07-12T00:00:00.000Z",
                      "distributionLossFactor": {
                        "code": "ABCFR",
                        "description": "Mandatory dscription for distribution loss factor",
                        "lossValue": "15.36"
                      },
                      "location": {
                        "addressUType": "paf",
                        "paf": {
                          "localityName": "Stark - Wright",
                          "postcode": "0056",
                          "state": "Western Australia",
                          "postalDeliveryType": "GPO_BOX",
                          "postalDeliveryNumber": 27610750,
                          "postalDeliveryNumberSuffix": "STS",
                          "flatUnitNumber": "2",
                          "buildingName1": "Reception area"
                        }
                      },
                      "relatedParticipants": [
                        {
                          "party": "Waters, Dare and Jacobs",
                          "role": "LNSP"
                        }
                      ],
                      "consumerProfile": {
                        "classification": "BUSINESS",
                        "threshold": "MEDIUM"
                      },
                      "meters": [
                        {
                          "meterId": "506955295",
                          "specifications": {
                            "installationType": "COMMS4",
                            "status": "DE_ENERGISED"
                          }
                        },
                        {
                          "meterId": "597832599",
                          "specifications": {
                            "installationType": "COMMS2",
                            "status": "DE_ENERGISED"
                          }
                        }
                      ]
                    }
                  },
                  {
                    "servicePoint": {
                      "jurisdictionCode": "QLD",
                      "lastUpdateDateTime": "2022-03-10T12:36:47.689Z",
                      "nationalMeteringId": "8043127465",
                      "servicePointClassification": "GENERATOR",
                      "servicePointId": "b35dd785-354c-419e-9e3c-46a1d1bf0afe",
                      "servicePointStatus": "ACTIVE",
                      "validFromDate": "2021-12-15T00:00:00.000Z",
                      "distributionLossFactor": {
                        "code": "ABCFR",
                        "description": "Mandatory dscription for distribution loss factor",
                        "lossValue": "19.60"
                      },
                      "location": {
                        "addressUType": "paf",
                        "paf": {
                          "localityName": "Ricardo Klein",
                          "postcode": "0936",
                          "state": "Queensland",
                          "thoroughfareNumber1": 4942,
                          "thoroughfareNumber1Suffix": "HWY",
                          "thoroughfareNumber2": 4943,
                          "thoroughfareNumber2Suffix": "HWY",
                          "floorLevelNumber": "19",
                          "streetName": "Georgia Parkway",
                          "streetType": "ROAD"
                        }
                      },
                      "relatedParticipants": [
                        {
                          "party": "Mann - Nicolas",
                          "role": "FRMP"
                        }
                      ],
                      "consumerProfile": {
                        "classification": "BUSINESS",
                        "threshold": "MEDIUM"
                      },
                      "meters": [
                        {
                          "meterId": "124645979",
                          "specifications": {
                            "installationType": "MRAM",
                            "status": "EXTINCT"
                          }
                        },
                        {
                          "meterId": "475249669",
                          "specifications": {
                            "installationType": "MRIM",
                            "status": "EXTINCT"
                          }
                        }
                      ]
                    }
                  },
                  {
                    "servicePoint": {
                      "jurisdictionCode": "ALL",
                      "lastUpdateDateTime": "2021-05-13T18:25:48.177Z",
                      "nationalMeteringId": "2311570361",
                      "servicePointClassification": "SMALL",
                      "servicePointId": "00c326ec-4f83-4db3-b3aa-f7cf8df39e1b",
                      "servicePointStatus": "EXTINCT",
                      "validFromDate": "2020-07-13T00:00:00.000Z",
                      "distributionLossFactor": {
                        "code": "ABCFR",
                        "description": "Mandatory dscription for distribution loss factor",
                        "lossValue": "19.25"
                      },
                      "location": {
                        "addressUType": "simple",
                        "simple": {
                          "mailingName": "Anderson, Barton and Hickle",
                          "localityName": "Cameronboro",
                          "addressLine1": "Declan Pass",
                          "postcode": "4420",
                          "city": "Mount Pleasant",
                          "state": "New South Wales",
                          "country": "AUS",
                          "addressLine2": "Apt. 512"
                        }
                      },
                      "relatedParticipants": [
                        {
                          "party": "Johns Pty Ltd",
                          "role": "DRSP"
                        }
                      ],
                      "consumerProfile": {
                        "classification": "BUSINESS",
                        "threshold": "HIGH"
                      },